[
  {
    "id": "concept-midwinter-celebration",
    "name": "the Midwinter celebration",
    "type": "concept",
    "description": "A traditional winter festival marked by lanterns, pine wreaths, and songs of hope and renewal.",
    "attributes": {},
    "first_seen_turn": "turn-001",
    "last_updated_turn": "turn-001"
  },
  {
    "id": "concept-promised-reward",
    "name": "the promised reward",
    "type": "concept",
    "description": "A significant prize or honor that was expected to be awarded for a particular deed or event.",
    "attributes": {},
    "first_seen_turn": "turn-001",
    "last_updated_turn": "turn-001"
  },
  {
    "id": "concept-name",
    "name": "the name [inference]",
    "type": "concept",
    "description": "A forgotten or unremembered term, possibly related to a tradition or event that has been missed.",
    "attributes": {},
    "first_seen_turn": "turn-001",
    "last_updated_turn": "turn-001"
  }
]
